{"v":1,"repo":"LearnURP","ts":"2026-05-31T07:51:40Z","wt":{"main":{"role":"user","br":"HandManage","head":"25a9580","subj":"Add worktree mediator and compact state tracking.","at":"2026-05-31T16:51:18+09:00","dirty":false,"chg":{"s":[],"u":[],"n":[]},"rem":{"up":"origin/HandManage","ah":0,"bh":1},"prog":{"task":"","done":[],"wip":[],"todo":[],"blk":[]}},"agent":{"role":"agent","br":"HandManage","head":"25a9580","subj":"Add worktree mediator and compact state tracking.","at":"2026-05-31T16:51:18+09:00","dirty":false,"chg":{"s":[],"u":[],"n":[]},"rem":{"up":"origin/HandManage","ah":0,"bh":1},"prog":{"task":"mediator-v1","done":[],"wip":["worktrees/state.json"],"todo":["commit"],"blk":[]}}}}
